No.     Time           Source                Destination           Protocol Length Info
    180 502.819664000  10.0.4.1              10.0.4.2              BGP      99     OPEN Message

Frame 180: 99 bytes on wire (792 bits), 99 bytes captured (792 bits) on interface 0
Ethernet II, Src: c8:01:30:54:00:01 (c8:01:30:54:00:01), Dst: c8:02:34:5c:00:01 (c8:02:34:5c:00:01)
Internet Protocol Version 4, Src: 10.0.4.1 (10.0.4.1), Dst: 10.0.4.2 (10.0.4.2)
Transmission Control Protocol, Src Port: 11000 (11000), Dst Port: 179 (179), Seq: 1, Ack: 1, Len: 45
Border Gateway Protocol - OPEN Message
    Marker: ffffffffffffffffffffffffffffffff
    Length: 45
    Type: OPEN Message (1)
    Version: 4
    My AS: 100
    Hold Time: 180
    BGP Identifier: 10.0.4.1 (10.0.4.1)
    Optional Parameters Length: 16
    Optional Parameters

No.     Time           Source                Destination           Protocol Length Info
    181 502.827068000  10.0.4.2              10.0.4.1              BGP      99     OPEN Message

Frame 181: 99 bytes on wire (792 bits), 99 bytes captured (792 bits) on interface 0
Ethernet II, Src: c8:02:34:5c:00:01 (c8:02:34:5c:00:01), Dst: c8:01:30:54:00:01 (c8:01:30:54:00:01)
Internet Protocol Version 4, Src: 10.0.4.2 (10.0.4.2), Dst: 10.0.4.1 (10.0.4.1)
Transmission Control Protocol, Src Port: 179 (179), Dst Port: 11000 (11000), Seq: 1, Ack: 46, Len: 45
Border Gateway Protocol - OPEN Message
    Marker: ffffffffffffffffffffffffffffffff
    Length: 45
    Type: OPEN Message (1)
    Version: 4
    My AS: 200
    Hold Time: 180
    BGP Identifier: 10.0.4.2 (10.0.4.2)
    Optional Parameters Length: 16
    Optional Parameters

No.     Time           Source                Destination           Protocol Length Info
    182 502.830070000  10.0.4.1              10.0.4.2              BGP      73     KEEPALIVE Message

Frame 182: 73 bytes on wire (584 bits), 73 bytes captured (584 bits) on interface 0
Ethernet II, Src: c8:01:30:54:00:01 (c8:01:30:54:00:01), Dst: c8:02:34:5c:00:01 (c8:02:34:5c:00:01)
Internet Protocol Version 4, Src: 10.0.4.1 (10.0.4.1), Dst: 10.0.4.2 (10.0.4.2)
Transmission Control Protocol, Src Port: 11000 (11000), Dst Port: 179 (179), Seq: 46, Ack: 46, Len: 19
Border Gateway Protocol - KEEPALIVE Message

No.     Time           Source                Destination           Protocol Length Info
    183 502.837107000  10.0.4.2              10.0.4.1              BGP      73     KEEPALIVE Message

Frame 183: 73 bytes on wire (584 bits), 73 bytes captured (584 bits) on interface 0
Ethernet II, Src: c8:02:34:5c:00:01 (c8:02:34:5c:00:01), Dst: c8:01:30:54:00:01 (c8:01:30:54:00:01)
Internet Protocol Version 4, Src: 10.0.4.2 (10.0.4.2), Dst: 10.0.4.1 (10.0.4.1)
Transmission Control Protocol, Src Port: 179 (179), Dst Port: 11000 (11000), Seq: 46, Ack: 65, Len: 19
Border Gateway Protocol - KEEPALIVE Message

No.     Time           Source                Destination           Protocol Length Info
    185 503.318396000  10.0.4.1              10.0.4.2              BGP      73     KEEPALIVE Message

Frame 185: 73 bytes on wire (584 bits), 73 bytes captured (584 bits) on interface 0
Ethernet II, Src: c8:01:30:54:00:01 (c8:01:30:54:00:01), Dst: c8:02:34:5c:00:01 (c8:02:34:5c:00:01)
Internet Protocol Version 4, Src: 10.0.4.1 (10.0.4.1), Dst: 10.0.4.2 (10.0.4.2)
Transmission Control Protocol, Src Port: 11000 (11000), Dst Port: 179 (179), Seq: 65, Ack: 65, Len: 19
Border Gateway Protocol - KEEPALIVE Message

No.     Time           Source                Destination           Protocol Length Info
    186 503.327784000  10.0.4.2              10.0.4.1              BGP      73     KEEPALIVE Message

Frame 186: 73 bytes on wire (584 bits), 73 bytes captured (584 bits) on interface 0
Ethernet II, Src: c8:02:34:5c:00:01 (c8:02:34:5c:00:01), Dst: c8:01:30:54:00:01 (c8:01:30:54:00:01)
Internet Protocol Version 4, Src: 10.0.4.2 (10.0.4.2), Dst: 10.0.4.1 (10.0.4.1)
Transmission Control Protocol, Src Port: 179 (179), Dst Port: 11000 (11000), Seq: 65, Ack: 84, Len: 19
Border Gateway Protocol - KEEPALIVE Message

No.     Time           Source                Destination           Protocol Length Info
    309 545.389782000  10.0.4.1              10.0.4.2              BGP      106    UPDATE Message

Frame 309: 106 bytes on wire (848 bits), 106 bytes captured (848 bits) on interface 0
Ethernet II, Src: c8:01:30:54:00:01 (c8:01:30:54:00:01), Dst: c8:02:34:5c:00:01 (c8:02:34:5c:00:01)
Internet Protocol Version 4, Src: 10.0.4.1 (10.0.4.1), Dst: 10.0.4.2 (10.0.4.2)
Transmission Control Protocol, Src Port: 11000 (11000), Dst Port: 179 (179), Seq: 84, Ack: 84, Len: 52
Border Gateway Protocol - UPDATE Message

No.     Time           Source                Destination           Protocol Length Info
    318 546.905361000  10.0.4.1              10.0.4.2              BGP      106    [TCP Retransmission] UPDATE Message

Frame 318: 106 bytes on wire (848 bits), 106 bytes captured (848 bits) on interface 0
Ethernet II, Src: c8:01:30:54:00:01 (c8:01:30:54:00:01), Dst: c8:02:34:5c:00:01 (c8:02:34:5c:00:01)
Internet Protocol Version 4, Src: 10.0.4.1 (10.0.4.1), Dst: 10.0.4.2 (10.0.4.2)
Transmission Control Protocol, Src Port: 11000 (11000), Dst Port: 179 (179), Seq: 84, Ack: 84, Len: 52
Border Gateway Protocol - UPDATE Message

No.     Time           Source                Destination           Protocol Length Info
    327 549.991552000  10.0.4.1              10.0.4.2              BGP      106    [TCP Retransmission] UPDATE Message

Frame 327: 106 bytes on wire (848 bits), 106 bytes captured (848 bits) on interface 0
Ethernet II, Src: c8:01:30:54:00:01 (c8:01:30:54:00:01), Dst: c8:02:34:5c:00:01 (c8:02:34:5c:00:01)
Internet Protocol Version 4, Src: 10.0.4.1 (10.0.4.1), Dst: 10.0.4.2 (10.0.4.2)
Transmission Control Protocol, Src Port: 11000 (11000), Dst Port: 179 (179), Seq: 84, Ack: 84, Len: 52
Border Gateway Protocol - UPDATE Message

No.     Time           Source                Destination           Protocol Length Info
    420 583.811641000  10.0.4.2              10.0.4.1              BGP      99     OPEN Message

Frame 420: 99 bytes on wire (792 bits), 99 bytes captured (792 bits) on interface 0
Ethernet II, Src: c8:02:34:5c:00:01 (c8:02:34:5c:00:01), Dst: c8:01:30:54:00:01 (c8:01:30:54:00:01)
Internet Protocol Version 4, Src: 10.0.4.2 (10.0.4.2), Dst: 10.0.4.1 (10.0.4.1)
Transmission Control Protocol, Src Port: 11001 (11001), Dst Port: 179 (179), Seq: 1, Ack: 1, Len: 45
Border Gateway Protocol - OPEN Message
    Marker: ffffffffffffffffffffffffffffffff
    Length: 45
    Type: OPEN Message (1)
    Version: 4
    My AS: 200
    Hold Time: 180
    BGP Identifier: 10.0.4.2 (10.0.4.2)
    Optional Parameters Length: 16
    Optional Parameters

No.     Time           Source                Destination           Protocol Length Info
    421 583.818648000  10.0.4.1              10.0.4.2              BGP      99     OPEN Message

Frame 421: 99 bytes on wire (792 bits), 99 bytes captured (792 bits) on interface 0
Ethernet II, Src: c8:01:30:54:00:01 (c8:01:30:54:00:01), Dst: c8:02:34:5c:00:01 (c8:02:34:5c:00:01)
Internet Protocol Version 4, Src: 10.0.4.1 (10.0.4.1), Dst: 10.0.4.2 (10.0.4.2)
Transmission Control Protocol, Src Port: 179 (179), Dst Port: 11001 (11001), Seq: 1, Ack: 46, Len: 45
Border Gateway Protocol - OPEN Message
    Marker: ffffffffffffffffffffffffffffffff
    Length: 45
    Type: OPEN Message (1)
    Version: 4
    My AS: 100
    Hold Time: 180
    BGP Identifier: 10.0.4.1 (10.0.4.1)
    Optional Parameters Length: 16
    Optional Parameters

No.     Time           Source                Destination           Protocol Length Info
    422 583.821150000  10.0.4.2              10.0.4.1              BGP      73     KEEPALIVE Message

Frame 422: 73 bytes on wire (584 bits), 73 bytes captured (584 bits) on interface 0
Ethernet II, Src: c8:02:34:5c:00:01 (c8:02:34:5c:00:01), Dst: c8:01:30:54:00:01 (c8:01:30:54:00:01)
Internet Protocol Version 4, Src: 10.0.4.2 (10.0.4.2), Dst: 10.0.4.1 (10.0.4.1)
Transmission Control Protocol, Src Port: 11001 (11001), Dst Port: 179 (179), Seq: 46, Ack: 46, Len: 19
Border Gateway Protocol - KEEPALIVE Message

No.     Time           Source                Destination           Protocol Length Info
    423 583.829524000  10.0.4.1              10.0.4.2              BGP      73     KEEPALIVE Message

Frame 423: 73 bytes on wire (584 bits), 73 bytes captured (584 bits) on interface 0
Ethernet II, Src: c8:01:30:54:00:01 (c8:01:30:54:00:01), Dst: c8:02:34:5c:00:01 (c8:02:34:5c:00:01)
Internet Protocol Version 4, Src: 10.0.4.1 (10.0.4.1), Dst: 10.0.4.2 (10.0.4.2)
Transmission Control Protocol, Src Port: 179 (179), Dst Port: 11001 (11001), Seq: 46, Ack: 65, Len: 19
Border Gateway Protocol - KEEPALIVE Message

No.     Time           Source                Destination           Protocol Length Info
    425 584.064898000  10.0.4.1              10.0.4.2              BGP      144    UPDATE Message, KEEPALIVE Message, KEEPALIVE Message

Frame 425: 144 bytes on wire (1152 bits), 144 bytes captured (1152 bits) on interface 0
Ethernet II, Src: c8:01:30:54:00:01 (c8:01:30:54:00:01), Dst: c8:02:34:5c:00:01 (c8:02:34:5c:00:01)
Internet Protocol Version 4, Src: 10.0.4.1 (10.0.4.1), Dst: 10.0.4.2 (10.0.4.2)
Transmission Control Protocol, Src Port: 179 (179), Dst Port: 11001 (11001), Seq: 65, Ack: 65, Len: 90
Border Gateway Protocol - UPDATE Message
Border Gateway Protocol - KEEPALIVE Message
Border Gateway Protocol - KEEPALIVE Message

No.     Time           Source                Destination           Protocol Length Info
    426 584.066915000  10.0.4.2              10.0.4.1              BGP      73     KEEPALIVE Message

Frame 426: 73 bytes on wire (584 bits), 73 bytes captured (584 bits) on interface 0
Ethernet II, Src: c8:02:34:5c:00:01 (c8:02:34:5c:00:01), Dst: c8:01:30:54:00:01 (c8:01:30:54:00:01)
Internet Protocol Version 4, Src: 10.0.4.2 (10.0.4.2), Dst: 10.0.4.1 (10.0.4.1)
Transmission Control Protocol, Src Port: 11001 (11001), Dst Port: 179 (179), Seq: 65, Ack: 155, Len: 19
Border Gateway Protocol - KEEPALIVE Message

No.     Time           Source                Destination           Protocol Length Info
    429 584.206043000  10.0.4.2              10.0.4.1              BGP      125    UPDATE Message, KEEPALIVE Message

Frame 429: 125 bytes on wire (1000 bits), 125 bytes captured (1000 bits) on interface 0
Ethernet II, Src: c8:02:34:5c:00:01 (c8:02:34:5c:00:01), Dst: c8:01:30:54:00:01 (c8:01:30:54:00:01)
Internet Protocol Version 4, Src: 10.0.4.2 (10.0.4.2), Dst: 10.0.4.1 (10.0.4.1)
Transmission Control Protocol, Src Port: 11001 (11001), Dst Port: 179 (179), Seq: 84, Ack: 155, Len: 71
Border Gateway Protocol - UPDATE Message
Border Gateway Protocol - KEEPALIVE Message

No.     Time           Source                Destination           Protocol Length Info
    572 641.341558000  10.0.4.1              10.0.4.2              BGP      73     KEEPALIVE Message

Frame 572: 73 bytes on wire (584 bits), 73 bytes captured (584 bits) on interface 0
Ethernet II, Src: c8:01:30:54:00:01 (c8:01:30:54:00:01), Dst: c8:02:34:5c:00:01 (c8:02:34:5c:00:01)
Internet Protocol Version 4, Src: 10.0.4.1 (10.0.4.1), Dst: 10.0.4.2 (10.0.4.2)
Transmission Control Protocol, Src Port: 179 (179), Dst Port: 11001 (11001), Seq: 155, Ack: 155, Len: 19
Border Gateway Protocol - KEEPALIVE Message

No.     Time           Source                Destination           Protocol Length Info
    583 644.632460000  10.0.4.2              10.0.4.1              BGP      73     KEEPALIVE Message

Frame 583: 73 bytes on wire (584 bits), 73 bytes captured (584 bits) on interface 0
Ethernet II, Src: c8:02:34:5c:00:01 (c8:02:34:5c:00:01), Dst: c8:01:30:54:00:01 (c8:01:30:54:00:01)
Internet Protocol Version 4, Src: 10.0.4.2 (10.0.4.2), Dst: 10.0.4.1 (10.0.4.1)
Transmission Control Protocol, Src Port: 11001 (11001), Dst Port: 179 (179), Seq: 155, Ack: 174, Len: 19
Border Gateway Protocol - KEEPALIVE Message

No.     Time           Source                Destination           Protocol Length Info
    739 700.441252000  10.0.4.1              10.0.4.2              BGP      73     KEEPALIVE Message

Frame 739: 73 bytes on wire (584 bits), 73 bytes captured (584 bits) on interface 0
Ethernet II, Src: c8:01:30:54:00:01 (c8:01:30:54:00:01), Dst: c8:02:34:5c:00:01 (c8:02:34:5c:00:01)
Internet Protocol Version 4, Src: 10.0.4.1 (10.0.4.1), Dst: 10.0.4.2 (10.0.4.2)
Transmission Control Protocol, Src Port: 179 (179), Dst Port: 11001 (11001), Seq: 174, Ack: 174, Len: 19
Border Gateway Protocol - KEEPALIVE Message

No.     Time           Source                Destination           Protocol Length Info
    751 704.727161000  10.0.4.2              10.0.4.1              BGP      73     KEEPALIVE Message

Frame 751: 73 bytes on wire (584 bits), 73 bytes captured (584 bits) on interface 0
Ethernet II, Src: c8:02:34:5c:00:01 (c8:02:34:5c:00:01), Dst: c8:01:30:54:00:01 (c8:01:30:54:00:01)
Internet Protocol Version 4, Src: 10.0.4.2 (10.0.4.2), Dst: 10.0.4.1 (10.0.4.1)
Transmission Control Protocol, Src Port: 11001 (11001), Dst Port: 179 (179), Seq: 174, Ack: 193, Len: 19
Border Gateway Protocol - KEEPALIVE Message

No.     Time           Source                Destination           Protocol Length Info
    875 760.500512000  10.0.4.1              10.0.4.2              BGP      73     KEEPALIVE Message

Frame 875: 73 bytes on wire (584 bits), 73 bytes captured (584 bits) on interface 0
Ethernet II, Src: c8:01:30:54:00:01 (c8:01:30:54:00:01), Dst: c8:02:34:5c:00:01 (c8:02:34:5c:00:01)
Internet Protocol Version 4, Src: 10.0.4.1 (10.0.4.1), Dst: 10.0.4.2 (10.0.4.2)
Transmission Control Protocol, Src Port: 179 (179), Dst Port: 11001 (11001), Seq: 193, Ack: 193, Len: 19
Border Gateway Protocol - KEEPALIVE Message

No.     Time           Source                Destination           Protocol Length Info
    879 764.843820000  10.0.4.2              10.0.4.1              BGP      73     KEEPALIVE Message

Frame 879: 73 bytes on wire (584 bits), 73 bytes captured (584 bits) on interface 0
Ethernet II, Src: c8:02:34:5c:00:01 (c8:02:34:5c:00:01), Dst: c8:01:30:54:00:01 (c8:01:30:54:00:01)
Internet Protocol Version 4, Src: 10.0.4.2 (10.0.4.2), Dst: 10.0.4.1 (10.0.4.1)
Transmission Control Protocol, Src Port: 11001 (11001), Dst Port: 179 (179), Seq: 193, Ack: 212, Len: 19
Border Gateway Protocol - KEEPALIVE Message

No.     Time           Source                Destination           Protocol Length Info
    885 770.117302000  10.0.4.2              10.0.4.3              BGP      99     OPEN Message

Frame 885: 99 bytes on wire (792 bits), 99 bytes captured (792 bits) on interface 0
Ethernet II, Src: c8:02:34:5c:00:01 (c8:02:34:5c:00:01), Dst: c8:03:28:18:00:01 (c8:03:28:18:00:01)
Internet Protocol Version 4, Src: 10.0.4.2 (10.0.4.2), Dst: 10.0.4.3 (10.0.4.3)
Transmission Control Protocol, Src Port: 11003 (11003), Dst Port: 179 (179), Seq: 1, Ack: 1, Len: 45
Border Gateway Protocol - OPEN Message
    Marker: ffffffffffffffffffffffffffffffff
    Length: 45
    Type: OPEN Message (1)
    Version: 4
    My AS: 200
    Hold Time: 180
    BGP Identifier: 10.0.4.2 (10.0.4.2)
    Optional Parameters Length: 16
    Optional Parameters

No.     Time           Source                Destination           Protocol Length Info
    886 770.136847000  10.0.4.3              10.0.4.2              BGP      99     OPEN Message

Frame 886: 99 bytes on wire (792 bits), 99 bytes captured (792 bits) on interface 0
Ethernet II, Src: c8:03:28:18:00:01 (c8:03:28:18:00:01), Dst: c8:02:34:5c:00:01 (c8:02:34:5c:00:01)
Internet Protocol Version 4, Src: 10.0.4.3 (10.0.4.3), Dst: 10.0.4.2 (10.0.4.2)
Transmission Control Protocol, Src Port: 179 (179), Dst Port: 11003 (11003), Seq: 1, Ack: 46, Len: 45
Border Gateway Protocol - OPEN Message
    Marker: ffffffffffffffffffffffffffffffff
    Length: 45
    Type: OPEN Message (1)
    Version: 4
    My AS: 300
    Hold Time: 180
    BGP Identifier: 10.0.4.1 (10.0.4.1)
    Optional Parameters Length: 16
    Optional Parameters

No.     Time           Source                Destination           Protocol Length Info
    887 770.138789000  10.0.4.2              10.0.4.3              BGP      73     KEEPALIVE Message

Frame 887: 73 bytes on wire (584 bits), 73 bytes captured (584 bits) on interface 0
Ethernet II, Src: c8:02:34:5c:00:01 (c8:02:34:5c:00:01), Dst: c8:03:28:18:00:01 (c8:03:28:18:00:01)
Internet Protocol Version 4, Src: 10.0.4.2 (10.0.4.2), Dst: 10.0.4.3 (10.0.4.3)
Transmission Control Protocol, Src Port: 11003 (11003), Dst Port: 179 (179), Seq: 46, Ack: 46, Len: 19
Border Gateway Protocol - KEEPALIVE Message

No.     Time           Source                Destination           Protocol Length Info
    888 770.147214000  10.0.4.3              10.0.4.2              BGP      73     KEEPALIVE Message

Frame 888: 73 bytes on wire (584 bits), 73 bytes captured (584 bits) on interface 0
Ethernet II, Src: c8:03:28:18:00:01 (c8:03:28:18:00:01), Dst: c8:02:34:5c:00:01 (c8:02:34:5c:00:01)
Internet Protocol Version 4, Src: 10.0.4.3 (10.0.4.3), Dst: 10.0.4.2 (10.0.4.2)
Transmission Control Protocol, Src Port: 179 (179), Dst Port: 11003 (11003), Seq: 46, Ack: 65, Len: 19
Border Gateway Protocol - KEEPALIVE Message

No.     Time           Source                Destination           Protocol Length Info
    889 770.159659000  10.0.4.2              10.0.4.3              BGP      106    UPDATE Message

Frame 889: 106 bytes on wire (848 bits), 106 bytes captured (848 bits) on interface 0
Ethernet II, Src: c8:02:34:5c:00:01 (c8:02:34:5c:00:01), Dst: c8:03:28:18:00:01 (c8:03:28:18:00:01)
Internet Protocol Version 4, Src: 10.0.4.2 (10.0.4.2), Dst: 10.0.4.3 (10.0.4.3)
Transmission Control Protocol, Src Port: 11003 (11003), Dst Port: 179 (179), Seq: 65, Ack: 65, Len: 52
Border Gateway Protocol - UPDATE Message

No.     Time           Source                Destination           Protocol Length Info
    890 770.168500000  10.0.4.3              10.0.4.2              BGP      144    KEEPALIVE Message, UPDATE Message, KEEPALIVE Message

Frame 890: 144 bytes on wire (1152 bits), 144 bytes captured (1152 bits) on interface 0
Ethernet II, Src: c8:03:28:18:00:01 (c8:03:28:18:00:01), Dst: c8:02:34:5c:00:01 (c8:02:34:5c:00:01)
Internet Protocol Version 4, Src: 10.0.4.3 (10.0.4.3), Dst: 10.0.4.2 (10.0.4.2)
Transmission Control Protocol, Src Port: 179 (179), Dst Port: 11003 (11003), Seq: 65, Ack: 117, Len: 90
Border Gateway Protocol - KEEPALIVE Message
Border Gateway Protocol - UPDATE Message
Border Gateway Protocol - KEEPALIVE Message

No.     Time           Source                Destination           Protocol Length Info
    891 770.170405000  10.0.4.2              10.0.4.3              BGP      139    UPDATE Message, KEEPALIVE Message, KEEPALIVE Message

Frame 891: 139 bytes on wire (1112 bits), 139 bytes captured (1112 bits) on interface 0
Ethernet II, Src: c8:02:34:5c:00:01 (c8:02:34:5c:00:01), Dst: c8:03:28:18:00:01 (c8:03:28:18:00:01)
Internet Protocol Version 4, Src: 10.0.4.2 (10.0.4.2), Dst: 10.0.4.3 (10.0.4.3)
Transmission Control Protocol, Src Port: 11003 (11003), Dst Port: 179 (179), Seq: 117, Ack: 155, Len: 85
Border Gateway Protocol - UPDATE Message
Border Gateway Protocol - KEEPALIVE Message
Border Gateway Protocol - KEEPALIVE Message

No.     Time           Source                Destination           Protocol Length Info
    892 770.181202000  10.0.4.2              10.0.4.1              BGP      101    UPDATE Message

Frame 892: 101 bytes on wire (808 bits), 101 bytes captured (808 bits) on interface 0
Ethernet II, Src: c8:02:34:5c:00:01 (c8:02:34:5c:00:01), Dst: c8:01:30:54:00:01 (c8:01:30:54:00:01)
Internet Protocol Version 4, Src: 10.0.4.2 (10.0.4.2), Dst: 10.0.4.1 (10.0.4.1)
Transmission Control Protocol, Src Port: 11001 (11001), Dst Port: 179 (179), Seq: 212, Ack: 212, Len: 47
Border Gateway Protocol - UPDATE Message

No.     Time           Source                Destination           Protocol Length Info
    913 820.622125000  10.0.4.1              10.0.4.2              BGP      73     KEEPALIVE Message

Frame 913: 73 bytes on wire (584 bits), 73 bytes captured (584 bits) on interface 0
Ethernet II, Src: c8:01:30:54:00:01 (c8:01:30:54:00:01), Dst: c8:02:34:5c:00:01 (c8:02:34:5c:00:01)
Internet Protocol Version 4, Src: 10.0.4.1 (10.0.4.1), Dst: 10.0.4.2 (10.0.4.2)
Transmission Control Protocol, Src Port: 179 (179), Dst Port: 11001 (11001), Seq: 212, Ack: 259, Len: 19
Border Gateway Protocol - KEEPALIVE Message

No.     Time           Source                Destination           Protocol Length Info
    917 823.963351000  10.0.4.2              10.0.4.1              BGP      73     KEEPALIVE Message

Frame 917: 73 bytes on wire (584 bits), 73 bytes captured (584 bits) on interface 0
Ethernet II, Src: c8:02:34:5c:00:01 (c8:02:34:5c:00:01), Dst: c8:01:30:54:00:01 (c8:01:30:54:00:01)
Internet Protocol Version 4, Src: 10.0.4.2 (10.0.4.2), Dst: 10.0.4.1 (10.0.4.1)
Transmission Control Protocol, Src Port: 11001 (11001), Dst Port: 179 (179), Seq: 259, Ack: 231, Len: 19
Border Gateway Protocol - KEEPALIVE Message

No.     Time           Source                Destination           Protocol Length Info
    920 828.128733000  10.0.4.3              10.0.4.2              BGP      73     KEEPALIVE Message

Frame 920: 73 bytes on wire (584 bits), 73 bytes captured (584 bits) on interface 0
Ethernet II, Src: c8:03:28:18:00:01 (c8:03:28:18:00:01), Dst: c8:02:34:5c:00:01 (c8:02:34:5c:00:01)
Internet Protocol Version 4, Src: 10.0.4.3 (10.0.4.3), Dst: 10.0.4.2 (10.0.4.2)
Transmission Control Protocol, Src Port: 179 (179), Dst Port: 11003 (11003), Seq: 155, Ack: 202, Len: 19
Border Gateway Protocol - KEEPALIVE Message

No.     Time           Source                Destination           Protocol Length Info
    922 831.002620000  10.0.4.2              10.0.4.3              BGP      73     KEEPALIVE Message

Frame 922: 73 bytes on wire (584 bits), 73 bytes captured (584 bits) on interface 0
Ethernet II, Src: c8:02:34:5c:00:01 (c8:02:34:5c:00:01), Dst: c8:03:28:18:00:01 (c8:03:28:18:00:01)
Internet Protocol Version 4, Src: 10.0.4.2 (10.0.4.2), Dst: 10.0.4.3 (10.0.4.3)
Transmission Control Protocol, Src Port: 11003 (11003), Dst Port: 179 (179), Seq: 202, Ack: 174, Len: 19
Border Gateway Protocol - KEEPALIVE Message

No.     Time           Source                Destination           Protocol Length Info
    944 880.717419000  10.0.4.1              10.0.4.2              BGP      73     KEEPALIVE Message

Frame 944: 73 bytes on wire (584 bits), 73 bytes captured (584 bits) on interface 0
Ethernet II, Src: c8:01:30:54:00:01 (c8:01:30:54:00:01), Dst: c8:02:34:5c:00:01 (c8:02:34:5c:00:01)
Internet Protocol Version 4, Src: 10.0.4.1 (10.0.4.1), Dst: 10.0.4.2 (10.0.4.2)
Transmission Control Protocol, Src Port: 179 (179), Dst Port: 11001 (11001), Seq: 231, Ack: 278, Len: 19
Border Gateway Protocol - KEEPALIVE Message

No.     Time           Source                Destination           Protocol Length Info
    948 884.077546000  10.0.4.2              10.0.4.1              BGP      73     KEEPALIVE Message

Frame 948: 73 bytes on wire (584 bits), 73 bytes captured (584 bits) on interface 0
Ethernet II, Src: c8:02:34:5c:00:01 (c8:02:34:5c:00:01), Dst: c8:01:30:54:00:01 (c8:01:30:54:00:01)
Internet Protocol Version 4, Src: 10.0.4.2 (10.0.4.2), Dst: 10.0.4.1 (10.0.4.1)
Transmission Control Protocol, Src Port: 11001 (11001), Dst Port: 179 (179), Seq: 278, Ack: 250, Len: 19
Border Gateway Protocol - KEEPALIVE Message

No.     Time           Source                Destination           Protocol Length Info
    951 888.266265000  10.0.4.3              10.0.4.2              BGP      73     KEEPALIVE Message

Frame 951: 73 bytes on wire (584 bits), 73 bytes captured (584 bits) on interface 0
Ethernet II, Src: c8:03:28:18:00:01 (c8:03:28:18:00:01), Dst: c8:02:34:5c:00:01 (c8:02:34:5c:00:01)
Internet Protocol Version 4, Src: 10.0.4.3 (10.0.4.3), Dst: 10.0.4.2 (10.0.4.2)
Transmission Control Protocol, Src Port: 179 (179), Dst Port: 11003 (11003), Seq: 174, Ack: 221, Len: 19
Border Gateway Protocol - KEEPALIVE Message

No.     Time           Source                Destination           Protocol Length Info
    953 891.063085000  10.0.4.2              10.0.4.3              BGP      73     KEEPALIVE Message

Frame 953: 73 bytes on wire (584 bits), 73 bytes captured (584 bits) on interface 0
Ethernet II, Src: c8:02:34:5c:00:01 (c8:02:34:5c:00:01), Dst: c8:03:28:18:00:01 (c8:03:28:18:00:01)
Internet Protocol Version 4, Src: 10.0.4.2 (10.0.4.2), Dst: 10.0.4.3 (10.0.4.3)
Transmission Control Protocol, Src Port: 11003 (11003), Dst Port: 179 (179), Seq: 221, Ack: 193, Len: 19
Border Gateway Protocol - KEEPALIVE Message

No.     Time           Source                Destination           Protocol Length Info
    973 940.905948000  10.0.4.1              10.0.4.2              BGP      73     KEEPALIVE Message

Frame 973: 73 bytes on wire (584 bits), 73 bytes captured (584 bits) on interface 0
Ethernet II, Src: c8:01:30:54:00:01 (c8:01:30:54:00:01), Dst: c8:02:34:5c:00:01 (c8:02:34:5c:00:01)
Internet Protocol Version 4, Src: 10.0.4.1 (10.0.4.1), Dst: 10.0.4.2 (10.0.4.2)
Transmission Control Protocol, Src Port: 179 (179), Dst Port: 11001 (11001), Seq: 250, Ack: 297, Len: 19
Border Gateway Protocol - KEEPALIVE Message

No.     Time           Source                Destination           Protocol Length Info
    977 944.158465000  10.0.4.2              10.0.4.1              BGP      73     KEEPALIVE Message

Frame 977: 73 bytes on wire (584 bits), 73 bytes captured (584 bits) on interface 0
Ethernet II, Src: c8:02:34:5c:00:01 (c8:02:34:5c:00:01), Dst: c8:01:30:54:00:01 (c8:01:30:54:00:01)
Internet Protocol Version 4, Src: 10.0.4.2 (10.0.4.2), Dst: 10.0.4.1 (10.0.4.1)
Transmission Control Protocol, Src Port: 11001 (11001), Dst Port: 179 (179), Seq: 297, Ack: 269, Len: 19
Border Gateway Protocol - KEEPALIVE Message

No.     Time           Source                Destination           Protocol Length Info
    980 948.368608000  10.0.4.3              10.0.4.2              BGP      73     KEEPALIVE Message

Frame 980: 73 bytes on wire (584 bits), 73 bytes captured (584 bits) on interface 0
Ethernet II, Src: c8:03:28:18:00:01 (c8:03:28:18:00:01), Dst: c8:02:34:5c:00:01 (c8:02:34:5c:00:01)
Internet Protocol Version 4, Src: 10.0.4.3 (10.0.4.3), Dst: 10.0.4.2 (10.0.4.2)
Transmission Control Protocol, Src Port: 179 (179), Dst Port: 11003 (11003), Seq: 193, Ack: 240, Len: 19
Border Gateway Protocol - KEEPALIVE Message

No.     Time           Source                Destination           Protocol Length Info
    982 950.163963000  10.0.4.2              10.0.4.3              BGP      73     KEEPALIVE Message

Frame 982: 73 bytes on wire (584 bits), 73 bytes captured (584 bits) on interface 0
Ethernet II, Src: c8:02:34:5c:00:01 (c8:02:34:5c:00:01), Dst: c8:03:28:18:00:01 (c8:03:28:18:00:01)
Internet Protocol Version 4, Src: 10.0.4.2 (10.0.4.2), Dst: 10.0.4.3 (10.0.4.3)
Transmission Control Protocol, Src Port: 11003 (11003), Dst Port: 179 (179), Seq: 240, Ack: 212, Len: 19
Border Gateway Protocol - KEEPALIVE Message
